,title,combined_text,bottom_label,top_label
93,budget 2018: 24 things you need to know,budget 2018: 24 things you need to know the chancellor has presented his budget to parliament – here's a summary of what was announced. 1. public finances have reached a turning point since 2009 2010 the deficit has fallen by four fifths from 9.9% to 1.9%. public debt peaked in 2016 17 and is now falling. on average spending on public services will grow 1.2% above inflation a year from next year until 2023 24. 2. employment is at a near record high and the obr forecasts it is set to keep growing the economy has grown every year since 2010 and is projected to continue growing in each year of the forecast. the unemployment rate is at its lowest for over 40 years there are over 3.3 million more people in work since 2010 and the obr forecasts 800 000 more jobs by 2022. 3. national living wage will increase to £8.21 from april 2019 the national living wage will increase from £7.83 an hour to £8.21. this will benefit around 2.4 million workers and is a £690 annual pay rise for a full time worker. 4. the tax free personal allowance will rise to £12 500 the personal allowance – the amount you earn before you have to start paying income tax– will increase by a further £650 in april 2019 to £12 500. this rise comes a year earlier than planned and will be maintained in 2020. this means a basic rate taxpayer will pay £1 205 less tax in 2019 20 than in 2010 11. 5. the higher rate threshold will increase from £46 350 to £50 000 in april 2019 the amount people will have to earn before they pay tax at 40% will increase from £46 350 to £50 000 in april 2019. this means that in 2019 20 there will be nearly 1 million fewer higher rate taxpayers than in 2015 16. 6. £1.7 billion to increase existing work allowances in universal credit increases to work allowances will mean working parents and people with disabilities claiming universal credit will be £630 better off each year. people will also receive extra help as they move from their existing benefits to universal credit and there will be targeted support for people repaying debts. 7. a new railcard for all young people aged 26 to 30 available nationally by the end of the year the first digital only railcard will offer up to a 1/3 off most rail travel. 8. fuel duty will remain frozen for a ninth year in 2019 fuel duty will remain frozen for the ninth year in a row saving the average driver £1 000 since 2010. 9. short haul rates of air passenger duty will not rise short haul rates of air passenger duty will not rise for the eighth year in a row keeping costs down for 80% of passengers. long haul rates will rise in line with inflation. 10. duty on beer cider and spirits remains frozen the cost of a pint of beer will be 2p lower than if duty had risen by inflation. 11. nhs funding will increase including more spending for mental health the nhs is the public’s number one priority and the government will increase its budget by £20.5 billion after inflation by 2023 24. within this the nhs will increase mental health spending by more than £2 billion a year by 2023 24. 12. £650 million for social care next year local authorities in england will receive a further £650 million in social care funding next year. 13. lifting the borrowing cap to allow local authorities to build more housing from today in england the government is lifting the cap on the amount of money local authorities are able to borrow to build housing. local authorities fund housing through a separate housing revenue account (hra). the welsh government is also taking immediate steps to lift the cap in wales. 14. £400 million extra for schools this year this will be £10 000 for the average primary school and £50 000 for the average secondary school. 15. a commemorative 50p brexit coin will be available to buy from spring 2019 the royal mint will create a new commemorative brexit coin to mark the uk’s exit from the european union. 16. up to £19 million in commemoration of the centenary of the wwi armistice up to £8 million to help with the cost of repairs and alternations to village halls miners’ welfare facilities and armed forces organisations’ facilities. £10 million to support veterans with mental health needs through the armed forces covenant fund trust. £1 million for first world war battlefield visits for school students. 17. £30 billion to improve roads a £28.8 billion national roads fund paid for by road tax includes £25.3 billion for the strategic road network (motorways trunk and a roads). the largest ever investment of this kind. it will also help fund the new network of local roads (known as the major road network) and larger local road projects. local authorities will receive £420 million to fix potholes on roads and renew bridges and tunnels and there will be a £150 million to improve local traffic hotspots such as roundabouts. 18. more money for scotland wales and northern ireland scotland wales and northern ireland will all get more money to spend in devolved areas including education health and housing. this budget means: over £950 million more for the scottish government through to 2020 21 over £550 million more for the welsh government through to 2020 21 over £320 million more for a northern ireland executive through to 2020 21 there will also be £150 million for a tay cities deal £120 million for a north wales growth deal £350 million for a belfast city region deal and opening negotiations on derry/londonderry and strabane city region deal. 19. over £1.5 billion to support the high street small retail businesses will see their business rates bills cut by a third for two years from april 2019 saving them £900 million. local high streets will benefit from £675 million to improve transport links re develop empty shops as homes and offices and restore and re use old and historic properties. public lavatories will receive 100% business rates relief. this adds to previous reductions in business rates since budget 2016 which will save firms over £12 billion over the next five years. 20. £1 billion more for defence over the next two years the ministry of defence will receive an extra £1 billion to help protect the uk against changing threats such as the rise in cyber attacks and the resurgence of state based threats. this funding adds to the £800 million announced earlier this year. 21. increasing funding to help departments to prepare for brexit to over £4 billion the government is providing £500 million of additional funding for departments to prepare for brexit for 2019 20. this is on top of the £1.5 billion already announced for that year. 22. the annual investment allowance will increase to £1 million from 1 january 2019 to 31 december 2020 the government will increase the annual investment allowance five fold from £200 000 to £1 million to help businesses to invest and grow. also from october 2018 businesses will be able to deduct 2% of the cost of any new non residential structures and buildings off their profits before they pay tax. 23. a 2% digital services tax on large digital firms from april 2020 large social media platforms search engines and online marketplaces will pay a 2% tax on the revenues they earn which are linked to uk users. 24. further changes to the apprenticeship levy to support employers from april large businesses will be able to invest up to 25% of their apprenticeship levy to support apprentices in their supply chain. some employers will pay half of what they currently pay for apprenticeship training – from 10% to 5%. the government will pay the remaining 95%. we will announce further details on when this will be available in early 2019.,2,-1
51,number of children in long-term workless households at lowest level in over a decade,number of children in long-term workless households at lowest level in over a decade the number of children in the uk living in long-term workless households is down 580 000 since 2010 falling to its lowest level in more than a decade. the independent figures from the office for national statistics today revealed that the number has been falling year on year since 2010 down 74 000 on the last year alone. this is welcome news for the next generation with evidence showing that growing up in a home with parents in work is linked to better performance in school and the increased likelihood of being in work as an adult. around 9 in 10 children now live in a home with at least one working adult with 3.3 million more people in work than in 2010. latest figures also show that the number of children living in lone parent long term workless households has fallen 70 000 on the year. the fall in numbers comes as the government’s welfare reforms are making sure it pays to be in work with flexible payments designed to ensure that claimants are always better off in work. work and pensions secretary esther mcvey said: helping people into work and supporting parents and children is at the heart of what this department does. over the last 8 years we have achieved something quite extraordinary transforming this country’s employment opportunities and with it children’s futures. and today we should celebrate that the number of children living in long term workless households is at its lowest level for over a decade. and with the latest budget announcements for universal credit we intend to help even more families as we increase the amount people can earn by £1 000 before their benefit payment begins to be reduced – making sure it pays to work and helping people come off benefits. the figures come while the uk has the lowest rate of unemployment since the 1970s and in more good news for homes across the country wages are outpacing inflation for the seventh month in a row. more information children who grow up in workless families are almost twice as likely as children in working families to not reach the expected attainment level at all stages of their education – analysis has shown that three quarters of children in workless families fail to reach 5 full gcses at grade c or above including english and maths. compared to children from working families those from workless families are also more likely to be workless in adult life. the improving lives: helping workless families policy paper includes research on the impact of children being in a workless family. contact press office press office caxton house tothill street london sw1h 9na london press office (national media and london area enquiries only – not questions about personal claims) 020 3267 5144 out of hours (journalists only) 07623 928 975 england and wales (local media enquiries) 029 20 586 then 097 or 098 or 099 scotland (local media enquiries) 0131 310 1122 follow dwp on: twitter – www.twitter.com/dwppressoffice facebook – www.facebook.com/dwp linkedin – www.linkedin.com/company/dwp youtube – www.youtube.com/dwp,2,-1
18,abstract of statistics 2018,abstract of statistics 2018 an annual publication covering statistics on benefits national insurance contributions and indices of prices and earnings in great britain. there is more information about these statistics on the abstract of statistics collection page . plans to discontinue this publication the department for work and pensions plans to discontinue the annual abstract of statistics publication. this is primarily to save resource and to allow us to focus on higher priority work. benefit uprating information contained in previous abstract of statistics publications will continue to be available on gov.uk. data relating to inflation prices and earnings is available on the office for national statistics website. to send us your views on these plans complete our questionnaire or email stats consultation@dwp.gov.uk . annual abstract of statistics for benefits and indices of prices and earnings 2018 ref: isbn: 978-1-78659-143-2 pdf 113kb 7 pages this file may not be suitable for users of assistive technology. request an accessible format. if you use assistive technology (such as a screen reader) and need a version of this document in a more accessible format please email accessible.formats@dwp.gov.uk . please tell us what format you need. it will help us if you say what assistive technology you use. abstract of statistics 2018: tables ods 309kb this file is in an opendocument format this file may not be suitable for users of assistive technology. request an accessible format. if you use assistive technology (such as a screen reader) and need a version of this document in a more accessible format please email accessible.formats@dwp.gov.uk . please tell us what format you need. it will help us if you say what assistive technology you use.,3,-1
86,dwp abstract of statistics questionnaire,dwp abstract of statistics questionnaire complete our questionnaire to tell us what you think about our abstract of statistics. the department for work and pensions ( dwp ) plans to discontinue the annual abstract of statistics publication. this is primarily to save resource and to allow us to focus on higher priority work. benefit uprating information contained in previous abstract of statistics publications will continue to be available on gov.uk. data relating to inflation prices and earnings is available on the office for national statistics website. your response to the questionnaire will help us understand the way our statistics are used and what users consider important. they will help determine whether or not dwp is right to discontinue the publication. return your completed questionnaire to stats consultation@dwp.gov.uk or if you would prefer to talk to the lead statistician for the series call alan gibson on 0191 216 2804. we plan to publish a response to the questionnaire later in 2019. dwp abstract of statistics questionnaire odt 10.6kb this file is in an opendocument format this file may not be suitable for users of assistive technology. request an accessible format. if you use assistive technology (such as a screen reader) and need a version of this document in a more accessible format please email accessible.formats@dwp.gsi.gov.uk . please tell us what format you need. it will help us if you say what assistive technology you use.,3,-1
45,claimant commitment,claimant commitment this call for evidence seeks views on the claimant commitment which universal credit claimants need to accept in order to receive universal credit payments. as part of its independent work programme the social security advisory committee ( ssac ) is conducting research into the claimant commitment. ssac is trying to gather evidence to underpin the research and would welcome input from a broad range of organisations and individuals who have relevant insights or evidence. call for evidence on the claimant commitment html,4,-1
30,social security and separated parents,social security and separated parents this call for evidence seeks views on the financial position of separated parents and the social security system. as part of its independent work programme the social security advisory committee ( ssac ) is conducting research into the financial position of separated parents and the social security system. ssac is trying to gather evidence to underpin the research and would welcome input from a broad range of organisations and individuals who have relevant insights or evidence. call for evidence on social security and separated parents html,4,-1
81,benefits and pensions for uk nationals in the eu eea or switzerland if there's a no-deal brexit,benefits and pensions for uk nationals in the eu eea or switzerland if there's a no-deal brexit this guidance explains the rights of uk nationals in the eu european economic area (eea) or switzerland to benefits and pensions if there’s a no-deal brexit. stay up to date the uk will leave the eu on 31 october 2019. this page tells you how to prepare for brexit. it will be updated if anything changes including if a deal is agreed. sign up to email alerts to get the latest information. uk pensions and benefits the uk leaving the eu will not affect your entitlement to continue receiving your uk state pension if you live in an eea state or switzerland. the uk leaving the eu will also not affect the uprating of your uk state pension in april 2020 april 2021 and april 2022 if you live in an eea state or switzerland. you will carry on receiving other uk benefits you already receive while you are living in an eea state or switzerland as long as you continue to meet the eligibility criteria. pensions and benefits paid by an eea state or switzerland if you are paid a pension or benefit by an eea state or switzerland check with the organisation that pays you to find out what will happen after brexit. annuities and personal pensions from a uk pension provider your pension provider should have made plans to make sure you can still get payments from your annuity or personal pension after brexit. your pension provider should contact you if they need to make changes to your annuity or pension or the way you are paid after brexit. if you have any questions contact your pension provider. uk workplace pensions uk law allows for workplace pensions to be paid overseas. the government does not expect this to change after brexit. if you have any questions contact your pension provider. if your workplace pension is paid into a uk bank account your bank should contact you if they need to change the way you receive your pension after brexit.,5,-1
23,benefits and pensions for eu eea and swiss citizens in the uk if there's a no-deal brexit,benefits and pensions for eu eea and swiss citizens in the uk if there's a no-deal brexit this guidance explains the rights of eu european economic area (eea) and swiss citizens to uk benefits and pensions if there’s a no-deal brexit. stay up to date the uk will leave the eu on 31 october 2019. this page tells you how to prepare for brexit. it will be updated if anything changes including if a deal is agreed. sign up to email alerts to get the latest information. eu eea and swiss citizens and their family members can apply to the eu settlement scheme to continue living in the uk after brexit. irish citizens living in the uk you and members of your family living in the uk will be able to claim or continue to receive the uk state pension and benefits you are entitled to after brexit. you will also continue to receive any irish benefits you remain entitled to while living in the uk. other eu eea and swiss citizens living in the uk before brexit you and your family members living in the uk by 31 october 2019 will be able to continue receiving uk benefits on the same terms as now. moving to the uk after brexit you will be able to enter the uk as now after brexit. you’ll need to apply for european temporary leave to remain to stay longer than 3 months and before the uk’s proposed new skills based immigration system begins in 2021. you’ll be eligible to claim benefits on the same basis as eu citizens who arrived in the uk before brexit if you have: been in the uk for less than 3 months european temporary leave to remain living in the eu eea or switzerland after brexit if you live in the eu eea or switzerland and get the uk state pension or a benefit you’ll continue to receive it as long as you meet the eligibility conditions. uk workplace pensions uk law allows for workplace pensions to be paid overseas. the government does not expect this to change after brexit. if you have any questions contact your pension provider. if your workplace pension is paid into a uk bank account your bank should contact you if they need to change the way you receive your pension after brexit.,5,-1
98,sign in to your universal credit account,sign in to your universal credit account sign in to your universal credit account - report a change add a note to your journal see your payments and do other tasks sign in to your universal credit account to: apply for an advance on your first payment see your statement report a change in circumstances add a note to your journal see your to do list see when your next payment will be see your claimant commitment use the username and password you set up when you applied for universal credit. you can ask for a reminder if you’re not sure. this service is also available in welsh (cymraeg) .,7,-1
29,gender of bank account holders on universal credit,gender of bank account holders on universal credit ad hoc statistics on couples claiming universal credit (uc) specifically the gender of the person whose bank account receives the uc payment. the figures presented in this ad hoc statistical release are from the department for work and pensions administrative records. whenever uc is paid the department records the bank account that the uc is paid to and this includes the name or names in which that account is held. this will show whether the account has 2 names attached or whether it is in one person’s name only. the data is for august 2018. gender of bank account holders on universal credit august 2018 html gender of bank account holders on universal credit august 2018 pdf 103kb 3 pages this file may not be suitable for users of assistive technology. request an accessible format. if you use assistive technology (such as a screen reader) and need a version of this document in a more accessible format please email accessible.formats@dwp.gsi.gov.uk . please tell us what format you need. it will help us if you say what assistive technology you use.,7,-1
91,transition from tax credits to universal credit: qualitative and quantitative research with claimants,transition from tax credits to universal credit: qualitative and quantitative research with claimants research to evaluate the experiences of customers who had stopped getting tax credits and had moved to universal credit after a change in their circumstances. this research evaluated the experience of customers who had stopped getting tax credits and ‘naturally’ migrated to universal credit (because of a change in their circumstances). the aim was to understand and therefore improve on their experience. the research had 2 elements: a quantitative phone survey and a qualitative face to face study. it was conducted jointly with the department for work and pensions. the transition from tax credits to universal credit: qualitative and quantitative research with claimants ref: hmrc research report 526 pdf 2.19mb 93 pages this file may not be suitable for users of assistive technology. request an accessible format. if you use assistive technology (such as a screen reader) and need a version of this document in a more accessible format please email different.format@hmrc.gsi.gov.uk . please tell us what format you need. it will help us if you say what assistive technology you use.,8,-1
48,concept testing the migration of tax credits customers to universal credit,concept testing the migration of tax credits customers to universal credit research exploring customers’ responses to an example migration journey testing their reactions and understanding and their perception of how smooth the journey might be. the aim of this research was to explore tax credits customers’ responses to an example of a ‘managed migration’ journey to universal credit. it tested their reactions and their understanding of what they may need to do and if they understood the consequences of inaction. the research also explored with participants how the migration could be made easier for them. the research was qualitative comprising face to face interviews and small group discussions. participants were customers likely to be included in the managed migration to universal credit. concept testing the migration of tax credits customers to universal credit ref: hmrc research report 525 pdf 988kb 48 pages this file may not be suitable for users of assistive technology. request an accessible format. if you use assistive technology (such as a screen reader) and need a version of this document in a more accessible format please email different.format@hmrc.gsi.gov.uk . please tell us what format you need. it will help us if you say what assistive technology you use.,8,-1
55,universal credit claimants with tax credit overpayments,universal credit claimants with tax credit overpayments this publication provides ad hoc statistics about universal credit customers with tax credit overpayment debts. this ad hoc release provides figures about the volumes of former tax credit customers now on universal credit with outstanding tax credit overpayments and the mean and median amounts owed per customer. the data in this publication is for 30 april 2019. volumes of universal credit claimants with tax credit overpayments html,8,-1
75,universal credit and severe disability premium claims,universal credit and severe disability premium claims ad hoc statistical release on payments made under the universal credit (managed migration pilot and miscellaneous amendments) regulations 2019. an ad hoc statistical release on payments made under the universal credit (managed migration pilot and miscellaneous amendments) regulations 2019 . the release covers: number of payments to date total payments to date average payments split of payments between limited capability for work and limited capability for work and work related activity groups universal credit and severe disability premium claims html,10,-1
