,title,combined_text,bottom_label,top_label
107,jobcentre areas where you can claim universal credit,jobcentre areas where you can claim universal credit universal credit is now available everywhere in great britain. jobcentre areas that deliver the universal credit service. apply for universal credit jobcentre areas a – d aberdare aberdeen abergavenny abertillery aberystwyth abingdon accrington acton airdrie aldershot alexandra park manchester alfreton alloa alnwick alton altrincham amlwch ammanford andover annan arbroath arnold ashfield ashford ashington ashton in makerfield ashton under lyne atherstone aylesbury ayr banbury banff bangor bargoed barking barnet barnsbury barnsley barnstaple barrhead barrow barry barton basildon basingstoke bath bathgate beccles bedford bedlington bedminster bedworth beeston belle vale bellshill belper berwick beverley bexhill bexleyheath bideford biggleswade billingham bilston birkenhead birmingham broad street birmingham city birmingham south west bishop auckland bishopsworth blackburn blackpool blackwood blairgowrie blandford blaydon blyth bodmin bolton great moor street bolton blackhorse street bognor bootle bordon borehamwood boston bournemouth bracknell bradford eastbrook court bradford westfield house braintree brecon brentwood bridgnorth bridgwater brighouse brighton bridgend bridlington bridport bristol temple street brixham bromborough bromley bromsgrove brownhills buckie bude bulwell burnley burton bury bury st. edmunds buxton caernarfon caerphilly caldicott camberley cambridge cambuslang campbeltown canning town cannock canterbury canvey cardiff alexandra house cardiff charles street cardigan carlisle carmarthen castleford castlemilk chapeltown chatham cheetham hill chelmsford chelmsley wood cheltenham chepstow chesham chester chester le street chesterfield chichester chippenham chorley chorlton cinderford cirencester clacton clevedon clitheroe clydebank coalville colchester coleford colwyn bay congleton consett corby cosham coventry cofa court cowdenbeath cramlington crawley crewe cromer crook crosby croydon cumbernauld cumnock cupar cwmbran dalkeith darlington dartford daventry derby city dereham devizes devonport dewsbury didcot didsbury dingwall dinnington diss dolgellau doncaster dover drumchapel dudley dumbarton dumfries dunfermline dundee dunoon durham jobcentre areas e – h jobcentre areas that deliver the universal credit service. ealing east kilbride eastbourne eastleigh ebbw vale eccles edmonton elgin ellesmere port ely enfield epsom erdington eston everton evesham exeter eyemouth fakenham falkirk fareham farnborough felixstowe finsbury park fleetwood flint folkestone forest hill forfar forres fort william fulham fraserburgh frome gainsborough galashiels garston gateshead girvan glenrothes glossop gloucester goldthorpe goole gorseinon gosport govan grangemouth grantham gravesend grays great yarmouth greenock grimsby guildford guisborough guiseley hackney halifax halesowen hamilton hammersmith handsworth hanley harlesden harlow harrogate harrow hartlepool harwich hastings hatfield havant haverfordwest haverhill hawick hayes haywards heath heanor helensburgh helston hemel hempstead hemsworth hendon hereford hertford hessle hexham heywood high riggs high wycombe hinckley holyhead honiton horefield horsham houghton le spring hounslow hove hoxton huddersfield hull britannia house huntingdon huyton hyde hythe jobcentre areas i – l jobcentre areas that deliver the universal credit service. ilkeston immingham invergordon inverness ipswich irlam irvine jarrow johnstone keighley kendal kennington park (the following postcodes will also be processed at kennington park: se5 9 se1p 6 se24 0 se24 4 se24 9 sw2 1 sw9 7 sw9 8) kentish town kettering kidderminster kidsgrove kilbirnie killingworth kilmarnock kings heath kings lynn kingston kingswood kirkby kirkcaldy kirkintilloch kirkwall lanark lancaster launceston laurieston leamington spa leeds southern house leeds park place leicester charles street leicester new walk leicester wellington street leigh leighton buzzard leiston leith leominster lerwick letchworth leven lewes leyland lichfield lincoln liskeard littlehampton liverpool city livingston llandrindod wells llandudno llanelli llangefni llantrisant loftus london bridge long eaton longsight longton loughborough loughton louth lowestoft luton lymington jobcentre areas m – p jobcentre areas that deliver the universal credit service. macclesfield machynlleth maesteg maidenhead maidstone maltby malvern mansfield margate market drayton market harborough marylebone matlock melton mowbray merthyr tydfil mexborough middlesbrough middlesbrough east middleton mildenhall milford haven milton keynes minehead mitcham mold montrose morecambe morley morpeth morriston motherwell musselburgh neath nelson neston newark newbury newcastle city newcastle east newcastle west newcastle under lyme newhaven newlands newmarket newport newquay newton abbot newton aycliffe newton heath newtown north kensington north shields north walsham northallerton northampton northwich norwich nottingham central nottingham loxley house nuneaton oban oldbury oldham openshaw ormskirk oswestry oxford paisley palmers green partick pembroke dock peckham penarth penicuik penrith penryn penzance perry barr perth peterborough peterhead peterlee plymouth pontefract pontypool pontypridd poole poplar port glasgow port talbot porth porthcawl porthmadog portree portsmouth preston prestwich pudsey purley pwllheli jobcentre areas r – u jobcentre areas that deliver the universal credit service. ramsgate rawtenstall rayleigh reading redbridge redcar redditch redhill redruth renfrew retford rhyl richmond ringwood rochdale romford ross on wye rotherham rothesay rugby runcorn rushden rusholme rutherglen ryde ryedale salford salisbury saltcoats scarborough scunthorpe seacroft seaham selby selly oak sheerness sheffield bailey sheffield cavendish court sheffield hillsborough sheffield woodhouse shepherd’s bush shettleston shirebrook shirehampton shotton shrewsbury sittingbourne skegness skelmersdale skipton sleaford slough smethwick solihull south shields southampton southend southport southwick spalding sparkhill spen valley spennymoor springburn st albans st andrews st annes st austell st helens staines stafford stamford stanley staveley stevenage stirling stockport stockton stockwell (the following postcodes will also be processed at stockwell: sw11 1 sw11 3 sw11 4 sw11 5 sw11 6 sw11 7 sw11 8 sw11 9 sw8 3) stornoway stourbridge stowmarket stranraer stratford stratford upon avon streatham (for these postcodes only: se19 1 se19 9 se27 0 se27 7 se27 9 sw17 8 sw17 9 sw2 3 sw2 4) stretford stroud sudbury sunderland sutton coldfield swadlincote swansea swindon tamworth taunton telford tewkesbury thetford thornaby thorne thornton heath tipton tiverton todmorden tonbridge tonypandy tottenham torquay totnes toxteth treorchy trowbridge truro twickenham upton uxbridge jobcentre areas v – z jobcentre areas that deliver the universal credit service. wakefield walsall bayard house walsall bridle court wallsend waltham cross walthamstow wandsworth warrington washington washwood heath watford wellingborough wells welshpool wembley west bromwich west derby wester hailes weston super mare weybridge weymouth whitby whitchurch whitehaven widnes wick wigan willenhall winchester winsford wisbech witham witney woking wolverhampton chapel court wolverhampton molineux house wombwell wood green woodbridge woolwich worcester workington worksop worsley worthing wrexham wythenshawe yardley yate yeovil york monkgate ystradgynlais,11,1
47,universal credit: full service and live service,universal credit: full service and live service this guidance explains the universal credit full service and live service. universal credit is now available in all parts of great britain. the way you manage your claim depends on whether or not you have an online account. full service universal credit full service is available to all types of claimants in great britain. you will have an online universal credit account to manage your claim. you can use your account to report changes send messages to your work coach and find support. eventually all universal credit claims will be on the full service. live service the universal credit live service is no longer available for new claims. if you are already getting universal credit and do not have an online account you will continue to manage your claim by phone. if your universal credit claim is paused because of increased earnings you will return to universal credit live service if your earnings fall as long as it is within 6 months. live service claims will eventually move to the full service. you will be notified when this will happen and what you need to do at that time. claiming universal credit you will always have access to a work coach who can help you with things like: finding work increasing the hours you work getting more prepared for when you are able to work by learning new work skills or life skills helping you to improve your income is central to the universal credit service. reporting changes how you report changes affecting your universal credit claim such as changing address or adding a child to your claim will depend on which service you use. full service areas use your universal credit online account to report changes by answering the questions on screen. the online service will also explain how to report changes you cannot report online at the moment. live service areas call the universal credit service centre to report changes: telephone: 0800 328 9344 monday to friday 9am to 4pm textphone: 0800 328 1344 monday to friday 8am to 6pm welsh language (make a claim): 0800 012 1888 welsh language (report changes): 0800 328 1744 monday to friday 8am to 6pm find out about call charges,11,1
90,universal credit full service omnibus survey,universal credit full service omnibus survey this report presents findings from 2 waves of tracking research with recent universal credit full service claimants. this report presents findings from 2 waves of surveys with a representative sample of recent universal credit full service claimants. the surveys examined how well new claimants understand the universal credit claim process and their rights and responsibilities with a view to meeting their information needs. 1 586 universal credit claimants were interviewed in wave 1 of the survey during october and november 2017. 1 445 different universal credit claimants were interviewed in wave 2 of the survey during may and june 2018. contribution to the evidence base this research was commissioned to develop a range of performance indicators for universal credit full service and to track understanding and knowledge of the main elements of the universal credit claim. research value the research has: enabled the department to develop performance indicators helped to inform the wider evidence base for the roll out of universal credit authors: trinh tu kelly maguire and natasha jones (ipsos mori) summary: universal credit full service omnibus survey: findings from 2 waves of tracking research with recent universal credit full service claimants html universal credit full service omnibus survey: findings from 2 waves of tracking research with recent universal credit full service claimants ref: isbn 978-1-5286-1024-7 rr976 pdf 1.23mb 36 pages this file may not be suitable for users of assistive technology. request an accessible format. if you use assistive technology (such as a screen reader) and need a version of this document in a more accessible format please email accessible.formats@dwp.gsi.gov.uk . please tell us what format you need. it will help us if you say what assistive technology you use.,11,1
52,universal credit national expansion 2015 to 2016,universal credit national expansion 2015 to 2016 local authorities and jobcentre areas that began to deliver universal credit as part of national expansion during 2015 and 2016. universal credit is now available everywhere in great britain. index of relevant districts (issued 20 july 2015) this is a list of the postcodes where universal credit was planned to go live between september 2015 and april 2016. * note – purley thornton heath and great yarmouth the list issued on 20 july 2015 includes postcodes administered by purley thornton heath and great yarmouth jobcentres. this indicates that a universal credit service for single jobseekers will launch in those areas from 18 january 15 february and 7 march 2016 respectively. a new commencement order has been made which specifies that universal credit will not now launch in these 3 postcode areas on the dates specified in the index. this reflects the plan for the expansion of the universal credit digital service during 2016. index of relevant districts (issued 10 february 2015) this is a list of the postcodes where universal credit was planned to go live between february and july 2015. tranche 3 (september 2015 to november 2015) and tranche 4 (december 2015 to april 2016) this lists the local authority and jobcentre areas where universal credit was planned to go live between september 2015 and april 2016. tranche 1 (february 2015 to april 2015) and tranche 2 (may 2015 to july 2015) this lists the local authority and jobcentre areas where universal credit was planned to go live between february and july 2015. more information this page is part of the universal credit toolkit for partner organisations. universal credit: index of relevant districts (issued 20 july 2015) *note the amendments to this index in the detail below pdf 747kb 62 pages this file may not be suitable for users of assistive technology. request an accessible format. if you use assistive technology (such as a screen reader) and need a version of this document in a more accessible format please email accessible.formats@dwp.gsi.gov.uk . please tell us what format you need. it will help us if you say what assistive technology you use. universal credit: index of relevant districts (issued 10 february 2015) pdf 397kb 37 pages this file may not be suitable for users of assistive technology. request an accessible format. if you use assistive technology (such as a screen reader) and need a version of this document in a more accessible format please email accessible.formats@dwp.gsi.gov.uk . please tell us what format you need. it will help us if you say what assistive technology you use. universal credit national expansion tranches 3 and 4 pdf 252kb 16 pages this file may not be suitable for users of assistive technology. request an accessible format. if you use assistive technology (such as a screen reader) and need a version of this document in a more accessible format please email accessible.formats@dwp.gsi.gov.uk . please tell us what format you need. it will help us if you say what assistive technology you use. welsh: ehangu credyd cynhwysol yn genedlaethol – cyfran tri a phedwar pdf 267kb 15 pages this file may not be suitable for users of assistive technology. request an accessible format. if you use assistive technology (such as a screen reader) and need a version of this document in a more accessible format please email accessible.formats@dwp.gsi.gov.uk . please tell us what format you need. it will help us if you say what assistive technology you use. universal credit national expansion tranches 1 and 2 pdf 119kb 10 pages this file may not be suitable for users of assistive technology. request an accessible format. if you use assistive technology (such as a screen reader) and need a version of this document in a more accessible format please email accessible.formats@dwp.gsi.gov.uk . please tell us what format you need. it will help us if you say what assistive technology you use. welsh: ehangu credyd cynhwysol yn genedlaethol – cyfran un a dau pdf 301kb 10 pages this file may not be suitable for users of assistive technology. request an accessible format. if you use assistive technology (such as a screen reader) and need a version of this document in a more accessible format please email accessible.formats@dwp.gsi.gov.uk . please tell us what format you need. it will help us if you say what assistive technology you use.,11,1
102,universal credit transition to full service,universal credit transition to full service universal credit is now available everywhere in great britain. universal credit is now available everywhere in great britain. the universal credit transition rollout schedule lists the dates jobcentres moved to the universal credit full service by local authority area. the schedule also includes a list of jobcentres that moved to the universal credit full service between november 2015 and february 2018 – this replaces the other documents on the page. more information see the jobcentre areas where couples and families can claim universal credit. this page is part of the universal credit toolkit for partner organisations. universal credit transition rollout schedule pdf 291kb 24 pages this file may not be suitable for users of assistive technology. request an accessible format. if you use assistive technology (such as a screen reader) and need a version of this document in a more accessible format please email accessible.formats@dwp.gsi.gov.uk . please tell us what format you need. it will help us if you say what assistive technology you use. welsh: credyd cynhwysol amserlen cyflwyno trosglwyddo pdf 310kb 25 pages this file may not be suitable for users of assistive technology. request an accessible format. if you use assistive technology (such as a screen reader) and need a version of this document in a more accessible format please email accessible.formats@dwp.gsi.gov.uk . please tell us what format you need. it will help us if you say what assistive technology you use. withdrawn: universal credit transition rollout schedule: phases 4 to 6 (april 2017 to september 2018) pdf 352kb 27 pages this file may not be suitable for users of assistive technology. request an accessible format. if you use assistive technology (such as a screen reader) and need a version of this document in a more accessible format please email accessible.formats@dwp.gsi.gov.uk . please tell us what format you need. it will help us if you say what assistive technology you use. tynnu'n ôl: welsh: amserlen cyflwyno trosglwyddo credyd cynhwysol : cam 4 a 6 (ebrill 2017 i medi 2018) pdf 434kb 29 pages this file may not be suitable for users of assistive technology. request an accessible format. if you use assistive technology (such as a screen reader) and need a version of this document in a more accessible format please email accessible.formats@dwp.gsi.gov.uk . please tell us what format you need. it will help us if you say what assistive technology you use. withdrawn: universal credit transition rollout schedule: phases 1 to 3 (may 2016 to march 2017) pdf 160kb 4 pages this file may not be suitable for users of assistive technology. request an accessible format. if you use assistive technology (such as a screen reader) and need a version of this document in a more accessible format please email accessible.formats@dwp.gsi.gov.uk . please tell us what format you need. it will help us if you say what assistive technology you use. tynnu'n ôl: welsh: amserlen cyflwyno trosglwyddo credyd cynhwysol: cam 1 a 3 (mai 2016 i fawrth 2017) pdf 173kb 5 pages this file may not be suitable for users of assistive technology. request an accessible format. if you use assistive technology (such as a screen reader) and need a version of this document in a more accessible format please email accessible.formats@dwp.gsi.gov.uk . please tell us what format you need. it will help us if you say what assistive technology you use.,11,1
49,dwp claimant service and experience survey 2017 to 2018,dwp claimant service and experience survey 2017 to 2018 this research monitors claimants' satisfaction with dwp services and ensures their views are considered in operational and policy planning. the objectives of this research are to: monitor claimant satisfaction with services provided by the department for work and pensions ( dwp ) across 10 benefits measured against overall satisfaction and the customer charter understand how claimants are interacting with dwp services including use of digital services and different communication channels capture the views and experiences of dwp ’s services and staff from claimants who have been in contact with dwp recently authors: sarah cheesbrough steven coutinho david xu simon edscer and charlotte saunders (kantar public). dwp claimant service and experience survey 2017 to 2018 ref: isbn 978-1-78659-127-2 rr971 pdf 430kb 38 pages this file may not be suitable for users of assistive technology. request an accessible format. if you use assistive technology (such as a screen reader) and need a version of this document in a more accessible format please email accessible.formats@dwp.gsi.gov.uk . please tell us what format you need. it will help us if you say what assistive technology you use. summary: dwp claimant service and experience survey 2017 to 2018 pdf 1.06mb 4 pages this file may not be suitable for users of assistive technology. request an accessible format. if you use assistive technology (such as a screen reader) and need a version of this document in a more accessible format please email accessible.formats@dwp.gsi.gov.uk . please tell us what format you need. it will help us if you say what assistive technology you use. methodological note: dwp claimant service and experience survey 2017 to 2018 pdf 402kb 29 pages this file may not be suitable for users of assistive technology. request an accessible format. if you use assistive technology (such as a screen reader) and need a version of this document in a more accessible format please email accessible.formats@dwp.gsi.gov.uk . please tell us what format you need. it will help us if you say what assistive technology you use. data tables: dwp claimant service and experience survey 2017 to 2018 ods 252kb this file is in an opendocument format this file may not be suitable for users of assistive technology. request an accessible format. if you use assistive technology (such as a screen reader) and need a version of this document in a more accessible format please email accessible.formats@dwp.gsi.gov.uk . please tell us what format you need. it will help us if you say what assistive technology you use.,16,1
